{
  "$schema": "../finish.schema.json",
  "name": "nimbus",
  "type": "finish",
  "format": 1,
  "label": "Nimbus",
  "blurb": "A gradient mesh of soft accent blooms + a seating vignette.",
  "order": 6,
  "swatch": {
    "background": "radial-gradient(60% 60% at 15% 20%, color-mix(in srgb, var(--accent) 55%, transparent), transparent 60%), radial-gradient(60% 60% at 85% 25%, color-mix(in srgb, var(--accent) 40%, transparent), transparent 58%), radial-gradient(60% 60% at 75% 90%, color-mix(in srgb, var(--accent) 34%, transparent), transparent 62%)"
  }
}
